source_id,title,domain,country,category,subcategory,file_type,file_path,url,summary,keywords,insights,added_at,update_batch,is_new,is_latest_update
0974c16d,Contents Executive Summary..............................................................................................,unknown,unknown,government,,txt,corpus_text/51ba373ace5b8615_7779d9276e.txt,,Contents Executive Summary.................................................................................................................................................... 2 Introduction................................................................................................................................................................. 3 Defining the Army Unified Network – The Enabler for Multidomain Operatio,"AI, power, compute",GOVERNMENT: critical infrastructure,2026-05-26,initial-import,no,no
5f736a91,Port MacKenzie Master Plan Update Loading Coal on a Super Panamax Ship (June 2010) By Matanuska-Susitna Borough Plann...,unknown,unknown,cooling,,txt,corpus_text/60fe3cfba609b532_fcf3ad07ac.txt,,Port MacKenzie Master Plan Update Loading Coal on a Super Panamax Ship (June 2010) By Matanuska-Susitna Borough Planning and Land Use Department Table of Contents 1. Introduction ...................................................................................................... 1 1.1 Overview ............................................................................,"AI, power, transmission",GOVERNMENT: critical infrastructure,2026-05-26,initial-import,no,no
bdd3eb0c,• • • International Advisory Body on Submarine Cable Resilience Mission: Enhance the resilience of submarine telecomm...,unknown,unknown,fiber,,txt,corpus_text/e7783c47cafc9ed3_1c66b4d4f7.txt,,"• • • International Advisory Body on Submarine Cable Resilience Mission: Enhance the resilience of submarine telecommunications cables, ensuring their role as vital infrastructure for global connectivity. Members (42): Diverse representation from governments, regulatory authorities, industry leaders, submarine cable experts, and international organisations. Working Methods: Combination of in-person (once per year) and virtual meetings, working groups, for an initial two-year term. In",AI,GOVERNMENT: critical infrastructure,2026-05-26,initial-import,no,no
494589d3,Achieving Depth Subsea Telecommunications Cables as Critical Infrastructure C A M I N O KA V A N A G H • J O N A S F...,unknown,unknown,fiber,,txt,corpus_text/03d68355986b44a5_54f3ad4eee.txt,,"Achieving Depth Subsea Telecommunications Cables as Critical Infrastructure C A M I N O KA V A N A G H • J O N A S F R A N K E N • W E N T I N G H E Acknowledgements Support from UNIDIR funders provides the foundation for all of the Institute’s activities. This study was produced by UNIDIR’s Security and Technology Programme (SECTEC), which is supported by the Governments of Czechia, Germany, Italy, the Netherlands, Norway, the Republic of Korea and Switzerland, and by Microsoft. SECTEC’s Cyber","AI, power, transmission, subsea, fiber, latency, Arctic, hyperscale, compute",FIBER: subsea; GOVERNMENT: critical infrastructure; GOVERNMENT: national security; GOVERNMENT: strategic infrastructure; AI: hyperscale,2026-05-26,initial-import,no,no
35db0cc4,2024 United States Data Center Energy Usage Report Dr.,unknown,unknown,power,,txt,corpus_text/84ddf9ddb91958f9_4ae33425ca.txt,,"2024 United States Data Center Energy Usage Report Dr. Sarah J. Smith Midwest Energy Solutions January 30, 2025 Total Data Center Estimates Total electricity use 176 TWh in 2023; modeled range 325-580 TWh in 2028 Server Data Center Estimates Electricity use by server type based on report assumptions Additional considerations • Forecasts are very uncertain o Short timeline (3-4 years) can be based on orders placed for chips, facilities under constructi","AI, electricity",,2026-05-26,initial-import,no,no
d75db1d1,The State of AI Infrastructure 2024 Edition An annual report on trends and developments in AI infrastructure based on...,unknown,unknown,power,,txt,corpus_text/554df8ec25abc7bf_1e29135770.txt,,"The State of AI Infrastructure 2024 Edition An annual report on trends and developments in AI infrastructure based on Microsoft- commissioned surveys conducted by Forrester Consulting and Ipsos. AI is sweeping across industries and transforming the way businesses operate, innovate, and compete. But how are organizations actually using AI today, and what are their plans for the future? What are the main challenges and priorities they face in implementing AI at scale? And what role does infr","AI, GPU, power, latency, compute",AI: AI infrastructure,2026-05-26,initial-import,no,no
491761c6,MINITAB 보조 도구 백서 이 문서는 Minitab 통계 소프트웨어의 보조 도구에서 사용되는 방법과 데이터 검사를 개발하기 위해 Minitab 통계 학자들이 실시한 연구에 대해 설명하는 전체 백서 중 하나입니다.,unknown,unknown,government,,txt,corpus_text/9980e5b9c59f0611_2abfb321a9.txt,,"MINITAB 보조 도구 백서 이 문서는 Minitab 통계 소프트웨어의 보조 도구에서 사용되는 방법과 데이터 검사를 개발하기 위해 Minitab 통계 학자들이 실시한 연구에 대해 설명하는 전체 백서 중 하나입니다. 실험 계획법(DOE) 개요 보조 도구 DOE는 핵심 Minitab에서 사용 가능한 DOE 요소의 일부를 포함하며, 설계를 만들고 분석하는 프로세스를 간소화하는 순차적 실험 프로세스를 사용합니다. 이 프로세스는 설계를 선별하여 가장 중요한 요인을 식별하는 것부터 시작됩니다. 그런 다음, 곡면성을 찾기 위한 고해상도 설계를 제공하고 반응을 최적화하는 요인 설정을 확인하기 위해 사용할 수 있는 최종 모형을 결정합니다. 이 문서에서는 실험 프로세스의 각 단계에 대해 요약합니다. 또한 보조 도구에서 제공할 설계를 결정한 방법에 대해 설명합니다(검정력 역할 포함). 데이터에서 곡면성을 탐지하고 적합화하는 프로세스에 대해서도 설명합니다. 이 문서에서는 데이터를 분석하고 최적",AI,,2026-05-26,initial-import,no,no
aac29cb2,"Data Centers and Their Energy Consumption: Frequently Asked Questions August 26, 2025 Congressional Research Service...",unknown,unknown,power,,txt,corpus_text/c4d366c31ff9a13c_d8fd116a16.txt,,"Data Centers and Their Energy Consumption: Frequently Asked Questions August 26, 2025 Congressional Research Service https://crsreports.congress.gov R48646 SUMMARY R486","AI, GPU, power, electricity, transmission, latency, cooling, PUE, hyperscale, compute",POWER: power demand; COOLING: PUE; AI: hyperscale,2026-05-26,initial-import,no,no
cd502173,Canada’s Arctic: A Strategic Blueprint for Resilient Sovereignty I.,unknown,unknown,government,,txt,corpus_text/c0bb160cbe9c1041_e54fedba08.txt,,"Canada’s Arctic: A Strategic Blueprint for Resilient Sovereignty I. Introduction: The Strategic Imperative Canada stands at a deﬁning moment. The US-led trade war and the strategic neglect of Canadian interests demand a bold reimagining of Canada’s economic and defense posture. This moment is not merely a crisis but a profound opportunity to reclaim strategic sovereignty and global leadership. To reclaim its strategic sovereignty, Canada should weave Arctic sovereignty, digital independence, an","AI, power, Arctic",COOLING: cold climate; GOVERNMENT: critical infrastructure; GOVERNMENT: national security,2026-05-26,initial-import,no,no
05e1628f,CONSORTIUM FOR ELECTRIC RELIABILITY TECHNOLOGY SOLUTIONS (CERTS) U.S.,unknown,unknown,power,,txt,corpus_text/e0e951a1c0d28ca5_7a4e6e5297.txt,,"CONSORTIUM FOR ELECTRIC RELIABILITY TECHNOLOGY SOLUTIONS (CERTS) U.S. Department of Energy Transmission Bottleneck Project Report March 19, 2003 Prepared by Jim Dyer Electric Power Group Page 2 DOE TRANSMISSION BOTTLENECK PROJECT REPORT TABLE OF CONTENTS Executive Summary………………………………………………","AI, power, electricity, transmission",POWER: electricity demand; POWER: transmission bottleneck; GOVERNMENT: national security,2026-05-26,initial-import,no,no
1fdd6f07,Working Document of the NPC Study: Arctic Potential: Realizing the Promise of U.S.,unknown,unknown,fiber,,txt,corpus_text/48b68afabf706bc8_c29b595872.txt,,"Working Document of the NPC Study: Arctic Potential: Realizing the Promise of U.S. Arctic Oil and Gas Resources Made Available March 27, 2015 Paper #7-10 COMMUNICATIONS SOLUTIONS IN THE ARCTIC Prepared for the Technology & Operations Subgroup On March 27, 201","AI, power, fiber, Arctic",,2026-05-26,initial-import,no,no
3b4cc3a9,NATIONAL STRATEGY FOR THE ARCTIC REGION OCTOBER 2022 NATIONAL STRATEGY FOR THE ARCTIC REGION 1 Table of Contents Exec...,unknown,unknown,government,,txt,corpus_text/ca2d3d8123c2653a_dbd4a4be4b.txt,,NATIONAL STRATEGY FOR THE ARCTIC REGION OCTOBER 2022 NATIONAL STRATEGY FOR THE ARCTIC REGION 1 Table of Contents Executive Summary ........................................................................................................................ 3 Introduction: Our Vision for the Arctic .......................................................................................... 5 Changing Conditions in the Arctic ..............................................................,"AI, power, transmission, subsea, Arctic",FIBER: subsea; GOVERNMENT: critical infrastructure; GOVERNMENT: national security,2026-05-26,initial-import,no,no
d54acc76,Coalition for Disaster Resilient Infrastructure EXECUTIVE SUMMARY Global Infrastructure Resilience 2025 Capturing the...,unknown,unknown,government,,txt,corpus_text/37504076ba469a4f_9a813fdfc5.txt,,Coalition for Disaster Resilient Infrastructure EXECUTIVE SUMMARY Global Infrastructure Resilience 2025 Capturing the Resilience Dividend A Biennial Report from the Coalition for Disaster Resilient Infrastructure This Work is a product of the Coalition for Disaster Resilient Infrastructure (CDRI) as part of the second Global Infrastructure Resilience report (GIR 2025) and features external contributions from multiple organizations. The,"AI, power, electricity, transmission, subsea, PUE",FIBER: subsea; COOLING: PUE; GOVERNMENT: critical infrastructure,2026-05-26,initial-import,no,no
14b8c51c,Arctic Report Card 2025 Twenty years of tracking rapid Arctic warming and change DOI: 10.25923/nrzf-j897 M.L.,unknown,unknown,Arctic,,txt,corpus_text/7caca2ddcac0e653_e50eb4fbc5.txt,,"Arctic Report Card 2025 Twenty years of tracking rapid Arctic warming and change DOI: 10.25923/nrzf-j897 M.L. Druckenmiller, R.L. Thoman, and T.A. Moon, Eds. December 2025 Matthew L. Druckenmiller, Richard L. Thoman, Twila A. Moon; Editors Mary Beth Armstrong, Cynthia Garcia; NOAA Coordinating Editors Sandy Lucas; NOAA Federal Advisor arctic.noaa.gov/report-card Ho","AI, power, cooling, Arctic, compute",GOVERNMENT: national security,2026-05-26,initial-import,no,no
960e01ec,In-Confidence Terms of Use: Provider access to Oranga Tamariki client record system (CYRAS).,unknown,unknown,AI,,txt,corpus_text/f991e9104b616f8f_cfff6a9c88.txt,,In-Confidence Terms of Use: Provider access to Oranga Tamariki client record system (CYRAS). Context Oranga Tamariki enables a small number of social service providers to have limited access to its client record system to support Oranga Tamariki work or to work on behalf of Oranga Tamariki. These Terms of Use apply to those social service providers as part of their contract with Oranga Tamariki. Definitions 1 CAPP means CYRAS-Approved Provide,"AI, power",,2026-05-26,initial-import,no,no
d1652280,Promotion of Watt-Bit Collaboration Project to achieve Green Transformation ~World’s first watt-bit collaboration opt...,unknown,unknown,power,,txt,corpus_text/266fc0d814f29ce7_4654cd613c.txt,,"Promotion of Watt-Bit Collaboration Project to achieve Green Transformation ~World’s first watt-bit collaboration optimization model experiment to being at The University of Tokyo campus ~ October 8, 2025 The University of Tokyo TEPCO Power Grid, Inc. The Uni","AI, power, transmission, compute",,2026-05-26,initial-import,no,no
63fffd1b,What is seen and shared in the IT System – a quick overview Gateway in CYRAS and at the DHB 1 How to create a referra...,unknown,unknown,government,,txt,corpus_text/5c1a8a2050548fe6_02f4773b03.txt,,"What is seen and shared in the IT System – a quick overview Gateway in CYRAS and at the DHB 1 How to create a referral on CYRAS • All children entering care must be referred for a Gateway assessment. If the child has been referred to FGC or had already had an FGC, consider if a Gateway referral would be helpful • Check if the child has had a Gateway ref",AI,,2026-05-26,initial-import,no,no
d11c3f4039d1,Lawrence Berkeley Lab publications,LBNL,US,data_center,research publications,txt,corpus_text/d11c3f4039d1.txt,https://eta.lbl.gov/publications,,,,2026-05-26,2026-05-25-alaska-climate-advantage-2,no,no
c587ca38c5d5,Electrifying Alaska Railbelt,zenodo.org,US-Alaska,power,Railbelt research,txt,corpus_text/c587ca38c5d5.txt,https://zenodo.org/records/14908275,,,,2026-05-26,2026-05-25-alaska-climate-advantage,no,no
2cc6ef6a5591,Electricity demand and data centers,EIA,US,power,electricity demand,txt,corpus_text/2cc6ef6a5591.txt,https://www.eia.gov/todayinenergy/detail.php?id=62084,,,,2026-05-26,2026-05-25-alaska-climate-advantage,no,yes
cbc5f0946ae9,Energy demand from AI,iea.org,International,AI,energy demand,txt,corpus_text/cbc5f0946ae9.txt,https://www.iea.org/reports/energy-and-ai/energy-demand-from-ai,,,,2026-05-26,2026-05-25-alaska-climate-advantage,no,yes
7a179a48aad8,Energy and AI executive summary,iea.org,International,AI,executive summary,txt,corpus_text/7a179a48aad8.txt,https://www.iea.org/reports/energy-and-ai/executive-summary,,,,2026-05-26,2026-05-25-alaska-climate-advantage,no,yes
f1fd6b517bc5,Data centres and data transmission networks,iea.org,International,data_center,energy efficiency,txt,corpus_text/f1fd6b517bc5.txt,https://www.iea.org/energy-system/buildings/data-centres-and-data-transmission-networks,,,,2026-05-26,2026-05-25-alaska-climate-advantage,no,yes
b4b1a22e2f8f,Electricity 2025,iea.org,International,power,electricity forecast,txt,corpus_text/b4b1a22e2f8f.txt,https://www.iea.org/reports/electricity-2025,,,,2026-05-26,2026-05-25-alaska-climate-advantage,no,yes
9d97589ef8f3,Electricity 2024,iea.org,International,power,electricity forecast,txt,corpus_text/9d97589ef8f3.txt,https://www.iea.org/reports/electricity-2024,,,,2026-05-26,2026-05-25-alaska-climate-advantage,no,yes
b41b3f175b32,Commercial computing electricity use,EIA,US,power,commercial computing,txt,corpus_text/b41b3f175b32.txt,https://www.eia.gov/todayinenergy/detail.php?id=65564,,,,2026-05-26,2026-05-25-alaska-climate-advantage,no,yes
ee5a25734c6e,Texas data centers and crypto mining,EIA,US,power,large load,txt,corpus_text/ee5a25734c6e.txt,https://www.eia.gov/todayinenergy/detail.php?id=63344,,,,2026-05-26,2026-05-25-alaska-climate-advantage,no,yes
8b32962b2a0b,US electricity consumption growth,EIA,US,power,electricity demand,txt,corpus_text/8b32962b2a0b.txt,https://www.eia.gov/todayinenergy/detail.php?id=65264,,,,2026-05-26,2026-05-25-alaska-climate-advantage,no,yes
d6032ef1f5fa,Annual Energy Outlook,EIA,US,power,energy outlook,txt,corpus_text/d6032ef1f5fa.txt,https://www.eia.gov/outlooks/aeo/,,,,2026-05-26,2026-05-25-alaska-climate-advantage,no,yes
7fb89daf4bad,Electric Power Monthly,EIA,US,power,electricity statistics,txt,corpus_text/7fb89daf4bad.txt,https://www.eia.gov/electricity/monthly/,,,,2026-05-26,2026-05-25-alaska-climate-advantage,no,yes
6407c34a43fa,EIA electricity demand forecast,EIA,US,power,demand forecast,txt,corpus_text/6407c34a43fa.txt,https://www.eia.gov/pressroom/releases/press582.php,,,,2026-05-26,2026-05-25-alaska-climate-advantage,no,yes
7a7c002b17ae,EIA data center pilot survey,EIA,US,power,data center survey,txt,corpus_text/7a7c002b17ae.txt,https://www.eia.gov/pressroom/releases/press585.php,,,,2026-05-26,2026-05-25-alaska-climate-advantage,no,yes
2636e2bd3619,National Transmission Needs Study,energy.gov,US,power,transmission,txt,corpus_text/2636e2bd3619.txt,https://www.energy.gov/gdo/national-transmission-needs-study,,,,2026-05-26,2026-05-25-alaska-climate-advantage,no,yes
4f08fd858fdb,Office of Electricity,energy.gov,US,power,grid reliability,txt,corpus_text/4f08fd858fdb.txt,https://www.energy.gov/oe/office-electricity,,,,2026-05-26,2026-05-25-alaska-climate-advantage,no,yes
a24539908ad3,LBNL publications portal,LBNL,US,data_center,research portal,txt,corpus_text/a24539908ad3.txt,https://eta-publications.lbl.gov/,,,,2026-05-26,2026-05-25-alaska-climate-advantage,no,yes
38b4de0668e2,NREL grid modernization,NREL,US,power,grid modernization,txt,corpus_text/38b4de0668e2.txt,https://www.nrel.gov/grid/,,,,2026-05-26,2026-05-25-alaska-climate-advantage,no,yes
85ee8e554a07,NIST artificial intelligence,nist.gov,US,AI,standards,txt,corpus_text/85ee8e554a07.txt,https://www.nist.gov/artificial-intelligence,,,,2026-05-26,2026-05-25-alaska-climate-advantage,no,yes
8a86f6609d46,NIST information technology laboratory,nist.gov,US,AI,IT standards,txt,corpus_text/8a86f6609d46.txt,https://www.nist.gov/itl,,,,2026-05-26,2026-05-25-alaska-climate-advantage,no,yes
107413b21894,DoD chief digital and artificial intelligence office,cto.mil,US,government,defense AI,txt,corpus_text/107413b21894.txt,https://www.cto.mil/ai/,,,,2026-05-26,2026-05-25-alaska-climate-advantage,no,yes
dc20dbdefaaf,White House statements and releases,whitehouse.gov,US,government,AI policy,txt,corpus_text/dc20dbdefaaf.txt,https://www.whitehouse.gov/briefing-room/statements-releases/,,,,2026-05-26,2026-05-25-alaska-climate-advantage,no,yes
85c85d376585,EU data centres policy,europa.eu,EU,policy,data centers,txt,corpus_text/85c85d376585.txt,https://digital-strategy.ec.europa.eu/en/policies/data-centres,,,,2026-05-26,2026-05-25-alaska-climate-advantage,no,yes
df6393d58a8d,EU artificial intelligence policy,europa.eu,EU,policy,AI regulation,txt,corpus_text/df6393d58a8d.txt,https://digital-strategy.ec.europa.eu/en/policies/artificial-intelligence,,,,2026-05-26,2026-05-25-alaska-climate-advantage,no,yes
caf61df924ea,EU cloud computing policy,europa.eu,EU,policy,cloud infrastructure,txt,corpus_text/caf61df924ea.txt,https://digital-strategy.ec.europa.eu/en/policies/cloud-computing,,,,2026-05-26,2026-05-25-alaska-climate-advantage,no,yes
8b333de305ab,What is the Railbelt,arcgis.com,US-Alaska,power,Railbelt overview,txt,corpus_text/8b333de305ab.txt,https://storymaps.arcgis.com/stories/5311a23d5b7c46cdae3e622fb6961e14,,,,2026-05-26,2026-05-25-alaska-climate-advantage,no,yes
f2ec1da98174,Uptime Institute resources,uptimeinstitute.com,International,data_center,reliability,txt,corpus_text/f2ec1da98174.txt,https://uptimeinstitute.com/resources,,,,2026-05-26,2026-05-25-alaska-climate-advantage,no,yes
e53e4e19cefc,CBRE insights,cbre.com,International,data_center,market research,txt,corpus_text/e53e4e19cefc.txt,https://www.cbre.com/insights,,,,2026-05-26,2026-05-25-alaska-climate-advantage,no,yes
6622367474a8,JLL insights,jll.com,International,data_center,market research,txt,corpus_text/6622367474a8.txt,https://www.jll.com/en-us/insights,,,,2026-05-26,2026-05-25-alaska-climate-advantage,no,yes
8b472f86bd50,Alaska Railbelt Decarbonization Study Executive Summary,UAF ACEP,US-Alaska,power,Railbelt executive summary,txt,corpus_text/8b472f86bd50.txt,https://www.uaf.edu/acep/files/media/ACEP_Railbelt_Decarbonization_Study_Final_Report__ExecutiveSummary.pdf,,,,2026-05-26,2026-05-25-alaska-climate-advantage,no,yes
cf5938f0c2b7,Railbelt Transmission Generation and Storage,Alaska Legislature,US-Alaska,power,Railbelt transmission investment,txt,corpus_text/cf5938f0c2b7.txt,https://www.akleg.gov/basis/get_documents.asp?docid=30402&session=33,,,,2026-05-26,2026-05-25-alaska-climate-advantage,no,yes
e9845d0118c8,Railbelt Energy,Alaska Energy Authority,US-Alaska,power,Railbelt energy,txt,corpus_text/e9845d0118c8.txt,https://www.akenergyauthority.org/What-We-Do/Railbelt-Energy,,,,2026-05-26,2026-05-25-alaska-climate-advantage,no,yes
6b5bef49f471,Railbelt Transmission Organization,Alaska Energy Authority,US-Alaska,power,Railbelt transmission,txt,corpus_text/6b5bef49f471.txt,https://www.akenergyauthority.org/What-We-Do/Railbelt-Energy/Railbelt-Transmission-Organization,,,,2026-05-26,2026-05-25-alaska-climate-advantage,no,yes
6d6a2bc1d89a,Alaska Railbelt renewables require capital investment,Alaska Beacon,US-Alaska,power,Railbelt investment,txt,corpus_text/6d6a2bc1d89a.txt,https://alaskabeacon.com/2024/01/23/report-alaskas-railbelt-can-shift-to-renewables-but-that-would-require-big-capital-investment/,,,,2026-05-26,2026-05-25-alaska-climate-advantage,no,yes
431b1e963ac7,KTOO Alaska Railbelt renewables investment,KTOO,US-Alaska,power,Railbelt investment,txt,corpus_text/431b1e963ac7.txt,https://www.ktoo.org/2024/01/23/report-alaskas-railbelt-can-shift-to-renewables-but-that-would-require-big-capital-investment/,,,,2026-05-26,2026-05-25-alaska-climate-advantage,no,yes
68e8d7ea48ed,Data Centers on Our Terms Alaska Center Whitepaper,The Alaska Center,US-Alaska,data_center,data center policy,txt,corpus_text/68e8d7ea48ed.txt,https://akcenter.org/wp-content/uploads/2026/01/Data-Centers-Whitepaper_The-Alaska-Center_January-2026.pdf,,,,2026-05-26,2026-05-25-alaska-climate-advantage,no,yes
5d1cbcea1e85,Huge data center could rise on Alaska North Slope,Alaska Beacon,US-Alaska,data_center,North Slope data center,txt,corpus_text/5d1cbcea1e85.txt,https://alaskabeacon.com/2026/05/14/a-huge-data-center-could-rise-on-alaskas-north-slope/,,,,2026-05-26,2026-05-25-alaska-climate-advantage,no,yes
32332112f3c8,Arctic Fiber submarine cable system,Submarine Networks,Arctic,fiber,Arctic fiber,txt,corpus_text/32332112f3c8.txt,https://www.submarinenetworks.com/en/systems/asia-europe-africa/arctic-fiber,,,,2026-05-26,2026-05-25-alaska-climate-advantage,no,yes
ea1930d26496,Sustainable Investment Opportunities in the Arctic,Arctic Economic Council,Arctic,investment,Arctic investment opportunities,txt,corpus_text/ea1930d26496.txt,https://arcticeconomiccouncil.com/wp-content/uploads/2022/10/sustainable-investment-opportunities-october-2022-low-res-3.pdf,,,,2026-05-26,2026-05-25-alaska-climate-advantage,no,yes
3e49e1473fca,Alaska Resources Library and Information Services,ARLIS,US-Alaska,Arctic,research library,txt,corpus_text/3e49e1473fca.txt,https://www.arlis.org/,,,,2026-05-26,2026-05-25-alaska-climate-advantage,no,yes
12ac715d8650,State of Alaska,State of Alaska,US-Alaska,government,state government,txt,corpus_text/12ac715d8650.txt,https://www.alaska.gov/,,,,2026-05-26,2026-05-25-alaska-climate-advantage,no,yes
b8198cb0a6c4,Alaska Department of Commerce Community and Economic Development,Alaska Commerce,US-Alaska,government,economic development,txt,corpus_text/b8198cb0a6c4.txt,https://www.commerce.alaska.gov/web/,,,,2026-05-26,2026-05-25-alaska-climate-advantage,no,yes
7ebd59282926,Alaska Industrial Development and Export Authority,AIDEA,US-Alaska,investment,state investment authority,txt,corpus_text/7ebd59282926.txt,https://www.aidea.org/,,,,2026-05-26,2026-05-25-alaska-climate-advantage,no,yes
bab621d5ee73,Alaska Gasline Development Corporation,AGDC,US-Alaska,energy_investment,LNG gasline,txt,corpus_text/bab621d5ee73.txt,https://www.agdc.us/,,,,2026-05-26,2026-05-25-alaska-climate-advantage,no,yes
26f8fd03087f,Port MacKenzie,Port MacKenzie,US-Alaska,manufacturing,industrial port,txt,corpus_text/26f8fd03087f.txt,https://www.portmackenzie.com/,,,,2026-05-26,2026-05-25-alaska-climate-advantage,no,yes
73756c3b2f2c,AI Data Centers and the US Electric Grid,Belfer Center,US,AI,power grid,txt,corpus_text/73756c3b2f2c.txt,https://www.belfercenter.org/research-analysis/ai-data-centers-us-electric-grid,,,,2026-05-26,2026-05-25-alaska-climate-advantage,no,yes
5a51d5aec35e,Alaska data center opportunity reality check,UAF ACEP,US-Alaska,climate_advantage,Alaska data center opportunity,txt,corpus_text/5a51d5aec35e.txt,https://www.uaf.edu/acep-blog/alaskas-data-center-opportunity-a-reality-check-and-possible-next-steps.php,,,,2026-05-26,2026-05-25-alaska-climate-advantage,no,yes
0d8c5a0ac67d,Can data centers lower Alaska high energy costs,UAF ACEP,US-Alaska,climate_advantage,energy cost and data centers,txt,corpus_text/0d8c5a0ac67d.txt,https://www.uaf.edu/acep-blog/can-data-centers-lower-alaskas-high-energy-costs.php,,,,2026-05-26,2026-05-25-alaska-climate-advantage,no,yes
0009540b061d,2024 Alaska Electricity Trends Report,UAF ACEP,US-Alaska,power,Alaska electricity trends,txt,corpus_text/0009540b061d.txt,https://acep-uaf.github.io/aetr-web-book-2024/2024-Alaska-Electricity-Trends-Report.pdf,,,,2026-05-26,2026-05-25-alaska-climate-advantage-2,no,yes
8df6d00181ac,Alaska Railbelt decarbonization project,UAF ACEP,US-Alaska,power,Railbelt decarbonization,txt,corpus_text/8df6d00181ac.txt,https://www.uaf.edu/acep/projects/railbelt-decarbonization.php,,,,2026-05-26,2026-05-25-alaska-climate-advantage,no,yes
72ec6d1131e9,Alaska Railbelt Electric System Decarbonization Study,UAF ACEP,US-Alaska,power,Railbelt decarbonization,txt,corpus_text/72ec6d1131e9.txt,https://www.uaf.edu/acep/files/media/ACEP_Railbelt_Decarbonization_Study_Final_Report.pdf,,,,2026-05-26,2026-05-25-alaska-climate-advantage,no,yes
50b7299283fd,Achieving an 80 percent Renewable Portfolio in Alaska Railbelt,NREL,US-Alaska,power,renewable portfolio,txt,corpus_text/50b7299283fd.txt,https://docs.nrel.gov/docs/fy24osti/85879.pdf,,,,2026-05-26,2026-05-25-alaska-climate-advantage,no,yes
